{
  "schemaVersion": "1.0.0",
  "generator": { "name": "td2d", "version": "0.0.0" },
  "assetId": "palette/auto-16",
  "generatedAt": "2026-10-03T08:38:13.404Z",
  "status": "pass",
  "checks": [
    { "id": "sprite-size", "status": "pass", "message": "Every sprite is 160 x 160." },
    {
      "id": "binary-alpha",
      "status": "pass",
      "message": "Every pixel is fully opaque or fully transparent."
    },
    { "id": "not-blank", "status": "pass", "message": "No sprite is blank." },
    { "id": "inside-frame", "status": "pass", "message": "No sprite touches the frame edge." },
    { "id": "grounded", "status": "pass", "message": "Every sprite reaches the ground line." },
    {
      "id": "max-colors",
      "status": "pass",
      "message": "Every sprite uses at most 16 colours (the most is 16)."
    },
    {
      "id": "palette",
      "status": "pass",
      "message": "Every opaque pixel uses one of the 16 palette colours."
    },
    {
      "id": "cleanup",
      "status": "pass",
      "message": "Cleanup removed 0 and recoloured 1486 stray pixel(s) across all sprites.",
      "details": { "removed": 0, "recoloured": 1486 }
    },
    { "id": "isolated-pixels", "status": "pass", "message": "No sprite has stray single pixels." },
    { "id": "sheet-size", "status": "pass", "message": "The sheet is 160 x 640." },
    {
      "id": "cells-in-bounds",
      "status": "pass",
      "message": "Every cell, with its extruded border, lies inside its sheet."
    },
    {
      "id": "frame-count",
      "status": "pass",
      "message": "All 4 planned frames are on the sheets, each once."
    }
  ]
}
