{
  "schemaVersion": "1.0.0",
  "generator": { "name": "td2d", "version": "0.0.0" },
  "assetId": "effects/energy-ball",
  "generatedAt": "2026-10-03T08:48:11.146Z",
  "status": "pass",
  "checks": [
    { "id": "sprite-size", "status": "pass", "message": "Every sprite is 64 x 64." },
    {
      "id": "binary-alpha",
      "status": "pass",
      "message": "Every pixel is fully opaque or fully transparent."
    },
    { "id": "not-blank", "status": "pass", "message": "No sprite is blank." },
    { "id": "inside-frame", "status": "pass", "message": "No sprite touches the frame edge." },
    {
      "id": "palette",
      "status": "pass",
      "message": "Every opaque pixel uses one of the 24 palette colours."
    },
    {
      "id": "jitter",
      "status": "pass",
      "message": "No frame's centre moves more than 2 px from the previous frame."
    },
    { "id": "isolated-pixels", "status": "pass", "message": "No sprite has stray single pixels." },
    { "id": "sheet-size", "status": "pass", "message": "The sheet is 512 x 64." },
    {
      "id": "cells-in-bounds",
      "status": "pass",
      "message": "Every cell, with its extruded border, lies inside its sheet."
    },
    {
      "id": "frame-count",
      "status": "pass",
      "message": "All 8 planned frames are on the sheets, each once."
    }
  ]
}
